job_key,company,title,location,department,urls,date_posted,first_seen,first_seen_pt,track,scored,score_method,experience_score,reason,emailed,source_uids
Kodiak Robotics:4173886009,Kodiak Robotics,Senior Vehicle Integration Engineer - Defense,"Mountain View, CA",Integration,https://job-boards.greenhouse.io/kodiak/jobs/4173886009,2026-07-02T16:51:45-04:00,2026-07-10T05:21:53+00:00,2026-07-09 22:21 Thu,AI / ML,true,CLI,18,"The candidate has strong software, computer vision, Python, Linux, and testing experience, but lacks the core senior vehicle integration background in automotive hardware, sensors/actuation integration, CAN, CAD, manufacturing, and 6+ years in autonomous vehicle or related physical systems.",false,greenhouse:Kodiak Robotics:4173886009
Kodiak Robotics:4173378009,Kodiak Robotics,Senior Vehicle Integration Engineer - Field Support ,"Mountain View, CA",Integration,https://job-boards.greenhouse.io/kodiak/jobs/4173378009,2026-07-02T16:51:45-04:00,2026-07-10T05:21:53+00:00,2026-07-09 22:21 Thu,AI / ML,true,CLI,28,"Strong Python/C++ and computer vision background with some diagnostic/tooling experience, but the role is senior field vehicle integration requiring hands-on autonomous vehicle hardware, electrical/mechanical systems, embedded automotive protocols, maintenance, and customer-site RCA experience that the resume largely lacks.",false,greenhouse:Kodiak Robotics:4173378009
Kodiak Robotics:4279969009,Kodiak Robotics,Sensor Hardware Engineer,"Mountain View, CA",Hardware,https://job-boards.greenhouse.io/kodiak/jobs/4279969009,2026-07-02T16:51:45-04:00,2026-07-10T05:21:53+00:00,2026-07-09 22:21 Thu,Computer Vision,true,CLI,35,"The candidate has strong computer vision, data analysis, C++/Python, and perception-adjacent experience, but lacks direct sensor hardware, automotive/aerospace, vehicle integration, manufacturing, lidar/radar/camera hardware testing, and hands-on mechanical/electrical systems experience central to this role.",false,greenhouse:Kodiak Robotics:4279969009
Kodiak Robotics:4239251009,Kodiak Robotics,Social Media Manager,"Mountain View, CA",Marketing,https://job-boards.greenhouse.io/kodiak/jobs/4239251009,2026-07-02T16:51:45-04:00,2026-07-10T05:21:53+00:00,2026-07-09 22:21 Thu,,false,,,,false,greenhouse:Kodiak Robotics:4239251009
Kodiak Robotics:4243323009,Kodiak Robotics,"Software Engineer, Routing","Mountain View, CA",Motion Planning,https://job-boards.greenhouse.io/kodiak/jobs/4243323009,2026-07-10T13:19:56-04:00,2026-07-10T17:37:16+00:00,2026-07-10 10:37 Fri,Computer Vision,true,Keyword,100,keyword-only heuristic,true,greenhouse:Kodiak Robotics:4243323009
Kodiak Robotics:4320932009,Kodiak Robotics,"Software Engineer, UI Tools Infrastructure","Mountain View, CA",Infrastructure,https://job-boards.greenhouse.io/kodiak/jobs/4320932009,2026-07-15T21:40:49-04:00,2026-07-16T01:59:08+00:00,2026-07-15 18:59 Wed,Computer Vision,true,Keyword,58,keyword-only heuristic,true,greenhouse:Kodiak Robotics:4320932009
Kodiak Robotics:4305442009,Kodiak Robotics,"Sr Product Manager, Assisted Autonomy","Mountain View, CA",Product Management,https://job-boards.greenhouse.io/kodiak/jobs/4305442009,2026-07-02T17:18:59-04:00,2026-07-10T05:21:53+00:00,2026-07-09 22:21 Thu,AI / ML,true,CLI,12,"The candidate has relevant ML/CV and some autonomy-adjacent technical background, but lacks the required 8+ years of senior product management, customer-scale product ownership, B2C UX, hardware/software PM, and AV/robotics deployment experience.",false,greenhouse:Kodiak Robotics:4305442009
Kodiak Robotics:4305446009,Kodiak Robotics,"Sr Product Manager, Command and Field Operations","Lancaster, TX",Product Management,https://job-boards.greenhouse.io/kodiak/jobs/4305446009,2026-07-02T17:19:46-04:00,2026-07-10T05:21:53+00:00,2026-07-09 22:21 Thu,AI / ML,true,CLI,12,"The candidate has strong engineering and computer vision experience but lacks product management experience, seniority, logistics/operations ownership, customer-facing product lifecycle leadership, and the required 8+ years in PM.",false,greenhouse:Kodiak Robotics:4305446009
Kodiak Robotics:4231590009,Kodiak Robotics,Staff Machine Learning Engineer - Data,San Francisco Bay Area,AI & Machine Learning,https://job-boards.greenhouse.io/kodiak/jobs/4231590009,2026-07-02T16:51:45-04:00,2026-07-10T05:21:53+00:00,2026-07-09 22:21 Thu,,false,,,,false,greenhouse:Kodiak Robotics:4231590009
Kodiak Robotics:4226655009,Kodiak Robotics,Staff Machine Learning Engineer - Deployment,San Francisco Bay Area,AI & Machine Learning,https://job-boards.greenhouse.io/kodiak/jobs/4226655009,2026-07-02T16:51:45-04:00,2026-07-10T05:21:53+00:00,2026-07-09 22:21 Thu,,false,,,,false,greenhouse:Kodiak Robotics:4226655009
Kodiak Robotics:4285251009,Kodiak Robotics,Staff Manufacturing Engineer,"Mountain View, CA",Manufacturing,https://job-boards.greenhouse.io/kodiak/jobs/4285251009,2026-07-02T16:51:45-04:00,2026-07-10T05:21:53+00:00,2026-07-09 22:21 Thu,,false,,,,false,greenhouse:Kodiak Robotics:4285251009
Kodiak Robotics:4307714009,Kodiak Robotics,Staff Product Analyst,"Mountain View, CA",Product Management,https://job-boards.greenhouse.io/kodiak/jobs/4307714009,2026-07-07T18:40:44-04:00,2026-07-10T05:21:53+00:00,2026-07-09 22:21 Thu,,false,,,,false,greenhouse:Kodiak Robotics:4307714009
Kodiak Robotics:4308530009,Kodiak Robotics,Staff Product Manager,"Mountain View, CA",Product Management,https://job-boards.greenhouse.io/kodiak/jobs/4308530009,2026-07-07T19:20:23-04:00,2026-07-10T05:21:53+00:00,2026-07-09 22:21 Thu,,false,,,,false,greenhouse:Kodiak Robotics:4308530009
Kodiak Robotics:4292556009,Kodiak Robotics,"Staff Software Engineer, Behavior Planning","Mountain View, CA",Motion Planning,https://job-boards.greenhouse.io/kodiak/jobs/4292556009,2026-07-02T16:51:45-04:00,2026-07-10T05:21:53+00:00,2026-07-09 22:21 Thu,,false,,,,false,greenhouse:Kodiak Robotics:4292556009
Kodiak Robotics:4090723009,Kodiak Robotics,"Staff Software Engineer, Embedded","Mountain View, CA",Embedded,https://job-boards.greenhouse.io/kodiak/jobs/4090723009,2026-07-02T16:51:45-04:00,2026-07-10T05:21:53+00:00,2026-07-09 22:21 Thu,,false,,,,false,greenhouse:Kodiak Robotics:4090723009
Kodiak Robotics:4294898009,Kodiak Robotics,"Staff Software Engineer, Learned & Hybrid Behavior Planning","Mountain View, CA",Motion Planning,https://job-boards.greenhouse.io/kodiak/jobs/4294898009,2026-07-02T16:51:45-04:00,2026-07-10T05:21:53+00:00,2026-07-09 22:21 Thu,,false,,,,false,greenhouse:Kodiak Robotics:4294898009
Kodiak Robotics:4183788009,Kodiak Robotics,"Staff Software Engineer, Mission Planning","Mountain View, CA",Motion Planning,https://job-boards.greenhouse.io/kodiak/jobs/4183788009,2026-07-05T20:54:23-04:00,2026-07-10T05:21:53+00:00,2026-07-09 22:21 Thu,,false,,,,false,greenhouse:Kodiak Robotics:4183788009
Kodiak Robotics:4076708009,Kodiak Robotics,"Staff Systems Engineer, Fault Management ",San Francisco Bay Area,Systems Engineering,https://job-boards.greenhouse.io/kodiak/jobs/4076708009,2026-07-02T16:51:45-04:00,2026-07-10T05:21:53+00:00,2026-07-09 22:21 Thu,,false,,,,false,greenhouse:Kodiak Robotics:4076708009
Kodiak Robotics:4313137009,Kodiak Robotics,Vehicle Electrical Integration Technician,"Odessa, Tx",Hardware,https://job-boards.greenhouse.io/kodiak/jobs/4313137009,2026-07-13T14:47:40-04:00,2026-07-13T18:59:13+00:00,2026-07-13 11:59 Mon,,false,,,,false,greenhouse:Kodiak Robotics:4313137009
Kodiak Robotics:4297603009,Kodiak Robotics,Vehicle Integration Engineer - Field Support ,"Mountain View, CA",Integration,https://job-boards.greenhouse.io/kodiak/jobs/4297603009,2026-07-02T16:51:45-04:00,2026-07-10T05:21:53+00:00,2026-07-09 22:21 Thu,AI / ML,true,CLI,45,"Strong Python/C++/CV and troubleshooting background fits parts of autonomous software diagnostics, but the role is primarily field vehicle integration requiring hands-on automotive hardware, embedded electronics, CAN/LIN/100BASE-T1, maintenance, and frequent site support experience that the resume does not show.",false,greenhouse:Kodiak Robotics:4297603009
Kodiak Robotics:4012631009,Kodiak Robotics,Vice President of Commercialization,Remote United States,Business Development,https://job-boards.greenhouse.io/kodiak/jobs/4012631009,2026-07-02T16:51:45-04:00,2026-07-10T05:21:53+00:00,2026-07-09 22:21 Thu,,false,,,,false,greenhouse:Kodiak Robotics:4012631009
Kodiak Robotics:4203253009,Kodiak Robotics,World Model Research Scientist- Physical AI,"Mountain View, CA",AI & Machine Learning,https://job-boards.greenhouse.io/kodiak/jobs/4203253009,2026-07-02T16:51:45-04:00,2026-07-10T05:21:53+00:00,2026-07-09 22:21 Thu,Computer Vision,true,CLI,35,"Strong Python/PyTorch/CV background with some 3D segmentation and RL experience, but the role targets a PhD-level research scientist with deep diffusion/video generation, neural rendering, multimodal driving sensor, large-scale training, and publication credentials that are mostly absent from the resume.",false,greenhouse:Kodiak Robotics:4203253009
