job_key,company,title,location,department,urls,date_posted,first_seen,first_seen_pt,track,scored,score_method,experience_score,reason,emailed,source_uids
Spot AI:595429,Spot AI,Enterprise Account Executive (Remote - East Coast),North Carolina; New York; New Jersey,Sales,https://jobs.spot.ai/jobs/595429-enterprise-account-executive-remote-east-coast,"Tue, 21 Apr 2026 13:30:26 -0700",2026-07-11T03:36:34+00:00,2026-07-10 20:36 Fri,,false,,,,false,teamtailor:Spot AI:595429
Spot AI:658877,Spot AI,Enterprise Account Executive (Remote - Texas),Texas,Sales,https://jobs.spot.ai/jobs/658877-enterprise-account-executive-remote-texas,"Tue, 07 Jul 2026 11:11:44 -0700",2026-07-11T03:36:34+00:00,2026-07-10 20:36 Fri,,false,,,,false,teamtailor:Spot AI:658877
Spot AI:542272,Spot AI,Enterprise Account Executive (Remote - West Coast / SF),"San Francisco, CA; Sandy, UT; Remote",Sales,https://jobs.spot.ai/jobs/542272-enterprise-account-executive-remote-west-coast-sf,"Thu, 22 Jan 2026 13:34:02 -0800",2026-07-11T03:36:34+00:00,2026-07-10 20:36 Fri,,false,,,,false,teamtailor:Spot AI:542272
Spot AI:658881,Spot AI,Enterprise Account Executive (Utah),"Sandy, UT",Sales,https://jobs.spot.ai/jobs/658881-enterprise-account-executive-utah,"Tue, 07 Jul 2026 11:16:04 -0700",2026-07-11T03:36:34+00:00,2026-07-10 20:36 Fri,,false,,,,false,teamtailor:Spot AI:658881
Spot AI:657735,Spot AI,"Manager, Hardware Operations","San Francisco, CA",Hardware Operations,https://jobs.spot.ai/jobs/657735-manager-hardware-operations,"Fri, 03 Jul 2026 10:17:52 -0700",2026-07-11T03:36:34+00:00,2026-07-10 20:36 Fri,AI / ML,true,CLI,12,"The candidate has strong computer vision and software experience, but this role is primarily hardware operations, NPI, contract manufacturing, supply chain, quality, ERP/logistics, and cost management, with little overlap beyond AI edge-compute context.",false,teamtailor:Spot AI:657735
Spot AI:613060,Spot AI,Partner Marketing Manager,"San Francisco, CA",Marketing,https://jobs.spot.ai/jobs/613060-partner-marketing-manager,"Thu, 14 May 2026 16:41:06 -0700",2026-07-11T03:36:34+00:00,2026-07-10 20:36 Fri,,false,,,,false,teamtailor:Spot AI:613060
Spot AI:594941,Spot AI,Solutions Engineer,"Remote; San Francisco, CA; Sandy, UT",Sales,https://jobs.spot.ai/jobs/594941-solutions-engineer,"Mon, 20 Apr 2026 15:54:09 -0700",2026-07-11T03:36:34+00:00,2026-07-10 20:36 Fri,,false,,,,false,teamtailor:Spot AI:594941
Spot AI:552572,Spot AI,"Sr. Growth Marketing Manager, Enterprise","San Francisco, CA",Marketing,https://jobs.spot.ai/jobs/552572-sr-growth-marketing-manager-enterprise,"Fri, 06 Feb 2026 09:42:13 -0800",2026-07-11T03:36:34+00:00,2026-07-10 20:36 Fri,,false,,,,false,teamtailor:Spot AI:552572
